report_id,recommendation_id,recommendation,extra_recommendation_context
2013_003,005/16,"Reinstate research into the dynamic behaviour of two-bladed, teetering, underslung rotor systems, taking full advantage of available technology, with the aim of achieving the original goal of NTSB recommendation A-96-12.",
2013_003,002/16,"The Commission recommended to the Director of Civil Aviation that he include the knowledge and training requirements of Special Federal Aviation Regulation No. 73, or an equivalent requirement, as a prerequisite for the issue of a Robinson R66 type rating.",
2013_003,011/16,"The Commission recommended to the Director of Civil Aviation that he promptly publicise the recent changes to the Robinson R66 (and R44) Pilot's Operating Handbooks that caution against flight in high winds and turbulence, and which advise pilots to reduce power and speed if turbulence is expected or encountered.",
2013_003,004/16,"The Commission recommended to the Administrator, FAA that he
extend the knowledge and training requirements of Special Federal Aviation Regulation No. 73 to pilots of the Robinson R66 helicopter.",
