report_id,recommendation_id,recommendation,extra_recommendation_context
2019_204,014/20,"On 18 November 2020 the Commission recommended that Rakiura Charters_x000D_
Limited ensure that its Maritime Transport Operator Plan assesses all risks_x000D_
associated with its operations and ensure that adequate guidance is available for_x000D_
skippers to make decisions on when it is safe to sail.",
2019_204,013/20,"On 18 November 2020 the Commission recommended that Maritime New Zealand ensure that future Maritime Rules require appropriate stability, buoyancy, and survivability assessments with respect to a vessel’s area of operation, and that information is made available for all domestic commercial passenger vessels.",
